{
  "$schema": "./coverage.schema.json",
  "schemaVersion": 1,
  "sourceId": "burkholder-grout-palisca-2019",
  "lastReviewed": "2026-07-19",
  "entries": [
    {
      "id": "part-ancient-medieval",
      "order": 1,
      "level": "part",
      "title": "Els mons antic i medieval",
      "pages": "23–192",
      "status": "drafted",
      "catalogIds": ["part-ancient-medieval"],
      "missing": ["editorial-review", "publication"]
    },
    {
      "id": "chapter-01-antiquity",
      "parentId": "part-ancient-medieval",
      "order": 1,
      "level": "chapter",
      "title": "La música a l'Antiguitat",
      "pages": "23–44",
      "topics": [
        {"title": "La música més antiga", "page": 24},
        {"title": "Mesopotàmia", "page": 25},
        {"title": "Cronologia", "page": 28, "kind": "chronology"},
        {"title": "La música en la vida i el pensament de l'antiga Grècia", "page": 29},
        {"title": "Concursos d'interpretació i músics professionals", "page": 38, "kind": "context"},
        {"title": "Roma", "page": 41},
        {"title": "El llegat grec", "page": 42, "kind": "reception"}
      ],
      "status": "drafted",
      "catalogIds": ["chapter-01-antiquity"],
      "missing": ["editorial-review", "publication"]
    },
    {
      "id": "chapter-02-early-church",
      "parentId": "part-ancient-medieval",
      "order": 2,
      "level": "chapter",
      "title": "L'Església cristiana en el primer mil·lenni",
      "pages": "45–74",
      "topics": [
        {"title": "L'expansió del cristianisme", "page": 45},
        {"title": "L'herència jueva", "page": 47},
        {"title": "La música a l'Església primitiva", "page": 49},
        {"title": "Divisions de l'Església i dialectes del cant", "page": 51},
        {"title": "Cronologia", "page": 52, "kind": "chronology"},
        {"title": "La notació", "page": 56, "kind": "innovation"},
        {"title": "Teoria i pràctica", "page": 63},
        {"title": "L'escriptori monàstic", "page": 64, "kind": "context"},
        {"title": "Ecos històrics", "page": 73, "kind": "reception"}
      ],
      "status": "drafted",
      "catalogIds": ["chapter-02-early-church"],
      "missing": ["works", "guided-listening", "recordings", "editorial-review", "publication"]
    },
    {
      "id": "chapter-03-roman-liturgy",
      "parentId": "part-ancient-medieval",
      "order": 3,
      "level": "chapter",
      "title": "La litúrgia romana i el cant pla",
      "pages": "75–100",
      "topics": [
        {"title": "La litúrgia romana", "page": 75},
        {"title": "La missa com a context ritual", "page": 78, "kind": "context"},
        {"title": "Característiques del cant", "page": 82},
        {"title": "Cronologia", "page": 83, "kind": "chronology"},
        {"title": "Gèneres i formes del cant", "page": 84},
        {"title": "Addicions al repertori autoritzat", "page": 93},
        {"title": "Hildegarda de Bingen", "page": 97},
        {"title": "Continuïtat del cant pla", "page": 99, "kind": "reception"}
      ],
      "status": "drafted",
      "catalogIds": ["chapter-03-roman-liturgy"],
      "missing": ["editorial-review", "publication"]
    },
    {
      "id": "chapter-04-medieval-song-dance",
      "parentId": "part-ancient-medieval",
      "order": 4,
      "level": "chapter",
      "title": "La cançó i la música de dansa a l'edat mitjana",
      "pages": "101–120",
      "topics": [
        {"title": "La societat europea, 800–1300", "page": 101, "kind": "context"},
        {"title": "La cançó llatina i vernacla", "page": 104},
        {"title": "Cronologia", "page": 105, "kind": "chronology"},
        {"title": "Trobadors, ciutat i cort", "page": 106, "kind": "context"},
        {"title": "Cançons de trobadors i trouvères", "page": 108},
        {"title": "La forma AAB", "page": 112},
        {"title": "Cançons en altres països", "page": 114},
        {"title": "Instruments", "page": 116},
        {"title": "Música de dansa", "page": 118},
        {"title": "Queixes d'amants", "page": 120, "kind": "interpretation"}
      ],
      "status": "drafted",
      "catalogIds": ["chapter-04-medieval-song-dance"],
      "missing": ["editorial-review", "publication"]
    },
    {
      "id": "chapter-05-thirteenth-century-polyphony",
      "parentId": "part-ancient-medieval",
      "order": 5,
      "level": "chapter",
      "title": "La polifonia al llarg del segle XIII",
      "pages": "121–156",
      "topics": [
        {"title": "L'organum primitiu", "page": 122},
        {"title": "La polifonia aquitana", "page": 126},
        {"title": "Notre-Dame", "page": 128},
        {"title": "Cronologia", "page": 136, "kind": "chronology"},
        {"title": "El conductus polifònic", "page": 140},
        {"title": "El motet", "page": 142},
        {"title": "La polifonia anglesa", "page": 151},
        {"title": "Una tradició perdurable", "page": 155, "kind": "reception"}
      ],
      "status": "drafted",
      "catalogIds": ["chapter-05-thirteenth-century-polyphony"],
      "missing": ["editorial-review", "publication"]
    },
    {
      "id": "chapter-06-fourteenth-century-france-italy",
      "parentId": "part-ancient-medieval",
      "order": 6,
      "level": "chapter",
      "title": "La música francesa i italiana al segle XIV",
      "pages": "157–192",
      "topics": [
        {"title": "La societat europea del segle XIV", "page": 157, "kind": "context"},
        {"title": "Cronologia", "page": 158, "kind": "chronology"},
        {"title": "L'Ars Nova a França", "page": 161},
        {"title": "Guillaume de Machaut", "page": 165},
        {"title": "La notació del ritme", "page": 167, "kind": "innovation"},
        {"title": "Les formes fixes", "page": 174},
        {"title": "L'Ars Subtilior", "page": 177},
        {"title": "El Trecento italià", "page": 179},
        {"title": "Interpretar la nova música", "page": 185, "kind": "interpretation"},
        {"title": "Ecos de l'Art Nou", "page": 192, "kind": "reception"}
      ],
      "status": "drafted",
      "catalogIds": ["chapter-06-fourteenth-century-france-italy"],
      "missing": ["editorial-review", "publication"]
    },
    {
      "id": "part-renaissance",
      "order": 2,
      "level": "part",
      "title": "El Renaixement",
      "pages": "199–368",
      "status": "indexed",
      "catalogIds": []
    },
    {
      "id": "chapter-07-music-renaissance",
      "parentId": "part-renaissance",
      "order": 1,
      "level": "chapter",
      "title": "La música i el Renaixement",
      "pages": "199–224",
      "topics": [
        {"title": "Europa entre 1400 i 1600", "page": 200, "kind": "context"},
        {"title": "El Renaixement en la cultura i l'art", "page": 201},
        {"title": "Cronologia", "page": 202, "kind": "chronology"},
        {"title": "El Renaixement en la música", "page": 208},
        {"title": "Músics cosmopolites i estil internacional", "page": 211},
        {"title": "Paraules i música", "page": 215},
        {"title": "Nous corrents del segle XVI", "page": 219},
        {"title": "Nous repertoris i gèneres", "page": 220},
        {"title": "La Reforma", "page": 220},
        {"title": "Llegat renaixentista", "page": 221, "kind": "reception"},
        {"title": "La música impresa", "page": 222, "kind": "innovation"}
      ],
      "status": "indexed",
      "catalogIds": [],
      "missing": ["context", "musical-language", "people", "works", "concepts", "sources", "guided-listening", "recordings", "editorial-review", "publication"]
    },
    {
      "id": "chapter-08-england-burgundy",
      "parentId": "part-renaissance",
      "order": 2,
      "level": "chapter",
      "title": "Anglaterra i Borgonya al segle XV",
      "pages": "225–252",
      "topics": [
        {"title": "La música anglesa", "page": 225},
        {"title": "Cronologia", "page": 229, "kind": "chronology"},
        {"title": "John Dunstable", "page": 231},
        {"title": "Les terres borgonyones", "page": 234, "kind": "context"},
        {"title": "Guillaume Dufay", "page": 238},
        {"title": "La missa polifònica", "page": 242},
        {"title": "Misses i dracs", "page": 248, "kind": "context"},
        {"title": "Un llenguatge imperible", "page": 250, "kind": "reception"}
      ],
      "status": "indexed",
      "catalogIds": [],
      "missing": ["context", "musical-language", "people", "works", "concepts", "sources", "guided-listening", "recordings", "editorial-review", "publication"]
    },
    {
      "id": "chapter-09-franco-flemish",
      "parentId": "part-renaissance",
      "order": 3,
      "level": "chapter",
      "title": "Els compositors francoflamencs, 1450–1520",
      "pages": "253–282",
      "topics": [
        {"title": "Canvi polític i consolidació", "page": 253, "kind": "context"},
        {"title": "Ockeghem i Busnois", "page": 254},
        {"title": "La generació de 1480–1520", "page": 261},
        {"title": "Cronologia", "page": 262, "kind": "chronology"},
        {"title": "Josquin des Prez", "page": 267},
        {"title": "Tipus de misses", "page": 278},
        {"title": "Misses sobre material preexistent", "page": 278},
        {"title": "El vell i el nou", "page": 280, "kind": "reception"}
      ],
      "status": "indexed",
      "catalogIds": [],
      "missing": ["context", "musical-language", "people", "works", "concepts", "sources", "guided-listening", "recordings", "editorial-review", "publication"]
    },
    {
      "id": "chapter-10-reformation-sacred-music",
      "parentId": "part-renaissance",
      "order": 4,
      "level": "chapter",
      "title": "La música sacra a l'era de la Reforma",
      "pages": "283–314",
      "topics": [
        {"title": "La Reforma", "page": 283, "kind": "context"},
        {"title": "La música luterana", "page": 285},
        {"title": "Cronologia", "page": 291, "kind": "chronology"},
        {"title": "La música calvinista", "page": 292},